{
  "schema_version": "0.1.0",
  "contract_id": "AOS-E2E-INTEGRATION-20260928-01",
  "production": "NO_GO",
  "paid_fallback": "DISABLED",
  "entities": {
    "project_identity": {"authority": "canonical_project_control", "required": true, "description": "Stable project identity, never inferred from a UI label."},
    "canonical_revision": {"authority": "canonical_control_ref", "required": true, "description": "Exact immutable control revision SHA."},
    "control_generation": {"authority": "planning_checkpoint", "required": true, "description": "Monotonic strategy/control generation."},
    "command_lineage": {"authority": "runtime_store", "required": true, "description": "Durable command identity preserved across waits and restarts."},
    "objective_id": {"authority": "planning_kernel", "required": true, "description": "Bounded objective selected from current canonical truth."},
    "task_id": {"authority": "task_dag", "required": true, "description": "DAG-local task identity."},
    "task_signature": {"authority": "integrity_reconciler", "required": true, "description": "Provider-neutral semantic work identity."},
    "workspace_fingerprint": {"authority": "workspace_fingerprint", "required": true, "description": "Source and workspace compatibility identity."},
    "write_scope": {"authority": "execution_authority", "required": true, "description": "Normalized paths an execution may mutate."},
    "lease_id": {"authority": "coordination_and_integrity", "required": true, "description": "Exclusive mutation epoch identity."},
    "resource_id": {"authority": "resource_ledger", "required": true, "description": "Stable execution or reasoning resource identity."},
    "resource_class": {"authority": "resource_policy", "required": true, "description": "Native, local reasoning, cloud reasoning, agentic, or browser class."},
    "capability_requirements": {"authority": "task_envelope", "required": true, "description": "Capabilities required by the task; not inferred from availability."},
    "health_state": {"authority": "latest_resource_observation", "required": true, "description": "Service health independent of quota and lane eligibility.", "allowed_values": ["HEALTHY", "DEGRADED", "UNAVAILABLE", "UNKNOWN"]},
    "quota_state": {"authority": "quota_governor", "required": true, "description": "Quota independent of health.", "allowed_values": ["AVAILABLE", "LOW", "EXHAUSTED", "UNKNOWN"]},
    "scarcity_state": {"authority": "resource_orchestrator", "required": true, "description": "Current scarcity/routing cost state.", "allowed_values": ["NORMAL", "SCARCE", "EXHAUSTED", "UNKNOWN"]},
    "session_id": {"authority": "agentic_checkpoint", "required": false, "description": "External executor session identity; never canonical authority."},
    "checkpoint_id": {"authority": "durable_coordinator", "required": true, "description": "Durable re-entry point."},
    "evidence_id": {"authority": "evidence_aggregator", "required": true, "description": "Immutable evidence record identity."},
    "accepted_source_sha": {"authority": "source_acceptance", "required": false, "description": "Exact accepted source SHA after tests and remote CI."},
    "candidate_id": {"authority": "candidate_store", "required": false, "description": "Immutable runtime candidate identity."},
    "runtime_slot": {"authority": "runtime_slot_store", "required": false, "description": "Activated slot identity; promotion is independent authority."},
    "runtime_source_sha": {"authority": "runtime_manifest", "required": false, "description": "Exact source SHA materialized into the runtime slot."},
    "provenance_status": {"authority": "provenance_validator", "required": true, "description": "Exact-SHA materialization result.", "allowed_values": ["PROVEN", "UNPROVEN", "FAIL"]}
  },
  "invariants": [
    {"invariant_id": "INV-01", "antecedent": "task mutates workspace", "consequent": "authority_id, workspace_fingerprint, nonempty write_scope, and exclusive lease_id are present", "enforcement": "planner validation plus integrity guard", "status": "ENFORCED"},
    {"invariant_id": "INV-02", "antecedent": "accepted task_signature exists for project and workspace generation", "consequent": "backend execution is skipped", "enforcement": "durable integrity accepted-work ledger", "status": "ENFORCED"},
    {"invariant_id": "INV-03", "antecedent": "active exclusive write scopes overlap in one workspace", "consequent": "new mutation is held before dispatch", "enforcement": "durable integrity lease claim", "status": "ENFORCED"},
    {"invariant_id": "INV-04", "antecedent": "agentic session resume is requested", "consequent": "backend, resource, source SHA, workspace fingerprint, adapter, executable, auth mode, and terminal state are compatible", "enforcement": "evaluate_agentic_resume", "status": "ENFORCED"},
    {"invariant_id": "INV-05", "antecedent": "resource is healthy", "consequent": "quota, credentials, service, scarcity, capabilities, and lane eligibility are still evaluated independently", "enforcement": "resource orchestrator", "status": "PARTIAL"},
    {"invariant_id": "INV-06", "antecedent": "runtime mutation control request is submitted", "consequent": "exact command, batch, generation, lane state, canonical revision, and PROVEN provenance match", "enforcement": "Human Action Center", "status": "ENFORCED"},
    {"invariant_id": "INV-07", "antecedent": "source is accepted", "consequent": "live promotion remains a separate human-gated decision", "enforcement": "candidate store and promotion boundary", "status": "ENFORCED"},
    {"invariant_id": "INV-08", "antecedent": "three consecutive batches have identical accepted-state fingerprints", "consequent": "REPLAN_NOOP enters TECHNICAL_HOLD", "enforcement": "planning kernel convergence guard", "status": "ENFORCED"},
    {"invariant_id": "INV-09", "antecedent": "material UI mutation is accepted", "consequent": "real-browser viewport evidence and critic result exist", "enforcement": "Design Intelligence pre/post stages", "status": "PARTIAL"},
    {"invariant_id": "INV-10", "antecedent": "any current protected lane is HUMAN_REQUIRED", "consequent": "relay aggregate HUMAN_REQUIRED is YES", "enforcement": "controller relay aggregation", "status": "ENFORCED"},
    {"invariant_id": "INV-11", "antecedent": "execution outcome is recorded", "consequent": "exactly one of six mutually exclusive outcome buckets increments", "enforcement": "integrity outcome ledger", "status": "ENFORCED"},
    {"invariant_id": "INV-12", "antecedent": "cockpit or relay displays state", "consequent": "display is projection only and cannot become canonical authority", "enforcement": "control architecture", "status": "DECLARED"}
  ]
}
